{
  "schema_version": "design-ontology-handoff/v1",
  "run_id": "world-cup-hub-reference-fidelity-20260714",
  "created_at": "2026-07-14T22:04:56+09:00",
  "project": "world-cup-hub",
  "from_role": "ui-implementer",
  "to_role": "reference-fidelity-auditor",
  "stage": "fidelity",
  "status": "ready",
  "summary": "Iteration 2 compresses the prose/KPI/ticker header and rebuilds the first screen as an asymmetric filter axis, schedule workspace, and selected-match context rail. Existing Semantic OS tokens and fixture-selection interactions remain intact. The runtime tree is frozen for fresh paired capture.",
  "input_artifacts": [
    {
      "path": "projects/world-cup-hub/build/system/production/reference-fidelity/latest_loop_report.json",
      "sha256": "9a818aba3e1694c7d303955694fc29474084a40aae46abcde015f94938c88dfc"
    }
  ],
  "output_artifacts": [
    {
      "path": "projects/world-cup-hub/fixture-desk/index.html",
      "sha256": "e33cd0bcec9a54aac861703e08029d2caa574d7fb65d8b688f7cc230e42f5239"
    },
    {
      "path": "projects/world-cup-hub/fixture-desk/styles.css",
      "sha256": "04f384058e8c08165482437b3f7f98243b2b786a4c3dcff75666450bb0f4ce9a"
    },
    {
      "path": "projects/world-cup-hub/fixture-desk/app.js",
      "sha256": "b4c7a5f259e67c99ba46e5517af4a76f5dfde7ea9ecd7aa346e48044ac027a55"
    }
  ],
  "changed_paths": [
    "projects/world-cup-hub/fixture-desk/index.html",
    "projects/world-cup-hub/fixture-desk/styles.css",
    "projects/world-cup-hub/fixture-desk/app.js"
  ],
  "decisions": [
    "The first viewport now prioritizes real fixture filters and rows instead of explanatory prose and metrics.",
    "Desktop uses a narrow filter axis, dense fixture table, and persistent selected-match rail as one asymmetric workspace.",
    "Mobile hides the secondary ticker and moves compact filters plus fixture rows directly after the operational strip.",
    "Reference palette, typography, copy, logos, and assets were not copied; existing Semantic OS tokens remain authoritative."
  ],
  "gate_results": [
    {
      "command": "node --check projects/world-cup-hub/fixture-desk/app.js",
      "status": "passed",
      "exit_code": 0,
      "evidence": "JavaScript syntax validation completed without output or errors."
    },
    {
      "command": "uv run design-ontology lint-implementation --target-repo projects/world-cup-hub/fixture-desk --json",
      "status": "passed",
      "exit_code": 0,
      "evidence": "Implementation lint inspected index.html, styles.css, and app.js with zero issues."
    },
    {
      "command": "uv run design-ontology check-style-divergence --project-dir projects/world-cup-hub/fixture-desk",
      "status": "passed",
      "exit_code": 0,
      "evidence": "Style divergence verdict OK; closest registered project similarity remained 0.41."
    }
  ],
  "blockers": [],
  "risks": [
    "All previous screenshot, browser, aesthetic, component-runtime, and fidelity evidence is stale against runtime tree 2c0454627684c3f8cba3481e142c7e162bec77d905983f3e0f68e6b001adab6b.",
    "Desktop/mobile and light/dark paired captures must be created before the fidelity score can be accepted."
  ],
  "next_action": "Reference Fidelity Auditor captures the frozen runtime at desktop/mobile in light/dark, compares the implementation and approved image together, then appends iteration 2 to the fidelity loop."
}
